{"contract_version":1,"status":"draft-ready","draft_markdown":"# Тест-кейсы\n\n## TC-VACS-001\n\n**Название:** Начальное значение поля «Визуальная информация» — «Нет»\n**Тип:** позитивный\n**Приоритет:** средний\n**package_id:** visual-assessment-conditional-v1\n**Трассировка:** OBL-COND-001; ATOM-COND-001\n\n### Предусловия\n\n1. Открыта форма с блоком, содержащим поле «Визуальная информация».\n\n### Тестовые данные\n\n- Не требуются.\n\n### Шаги\n\n1. Открыть блок с полем «Визуальная информация» без изменения его значения.\n\n### Итоговый ожидаемый результат\n\nПри первом открытии блока поле «Визуальная информация» отображает значение «Нет».\n\n### Постусловия\n\n- Не требуются.\n\n## TC-VACS-002\n\n**Название:** Отображение списка параметров при выборе «Да»\n**Тип:** позитивный\n**Приоритет:** средний\n**package_id:** visual-assessment-conditional-v1\n**Трассировка:** OBL-COND-002; ATOM-COND-002\n\n### Предусловия\n\n1. Открыта форма с полем «Визуальная информация».\n\n### Тестовые данные\n\n- Значение поля «Визуальная информация»: «Да».\n\n### Шаги\n\n1. Выбрать в поле «Визуальная информация» значение «Да».\n\n### Итоговый ожидаемый результат\n\nСписок «Параметры визуальной оценки» видим.\n\n### Постусловия\n\n- Не требуются.\n\n## TC-VACS-003\n\n**Название:** Скрытие списка параметров при выборе «Нет»\n**Тип:** позитивный\n**Приоритет:** средний\n**package_id:** visual-assessment-conditional-v1\n**Трассировка:** OBL-COND-003; ATOM-COND-003\n\n### Предусловия\n\n1. Открыта форма с полем «Визуальная информация».\n2. В поле «Визуальная информация» выбрано значение «Да», список «Параметры визуальной оценки» отображается.\n\n### Тестовые данные\n\n- Значение поля «Визуальная информация»: «Нет».\n\n### Шаги\n\n1. Выбрать в поле «Визуальная информация» значение «Нет».\n\n### Итоговый ожидаемый результат\n\nСписок «Параметры визуальной оценки» отсутствует на форме.\n\n### Постусловия\n\n- Не требуются.\n\n## TC-VACS-004\n\n**Название:** Отображение комментария при выборе «Другое» в категории «Признаки алкоголика»\n**Тип:** позитивный\n**Приоритет:** средний\n**package_id:** visual-assessment-conditional-v1\n**Трассировка:** OBL-COND-004; ATOM-COND-004\n\n### Предусловия\n\n1. Открыта форма с полем «Визуальная информация».\n2. В поле «Визуальная информация» выбрано значение «Да», список «Параметры визуальной оценки» отображается.\n\n### Тестовые данные\n\n- Категория: «Признаки алкоголика».\n- Значение: «Другое (комментарий обязателен)».\n\n### Шаги\n\n1. В категории «Признаки алкоголика» выбрать значение «Другое (комментарий обязателен)».\n\n### Итоговый ожидаемый результат\n\nВ категории «Признаки алкоголика» отображается связанное текстовое поле комментария.\n\n### Постусловия\n\n- Не требуются.\n\n## TC-VACS-005\n\n**Название:** Одновременный выбор двух обычных значений категории «Признаки алкоголика»\n**Тип:** позитивный\n**Приоритет:** средний\n**package_id:** visual-assessment-conditional-v1\n**Трассировка:** OBL-COND-005; ATOM-COND-005\n\n### Предусловия\n\n1. Открыта форма с полем «Визуальная информация».\n2. В поле «Визуальная информация» выбрано значение «Да», список «Параметры визуальной оценки» отображается.\n\n### Тестовые данные\n\n- Категория: «Признаки алкоголика».\n- Значение 1: «Запах алкоголя / перегара / сильный запах духов, перебивающий перегар».\n- Значение 2: «Отечность, нездоровый цвет лица, синяки под глазами».\n\n### Шаги\n\n1. В категории «Признаки алкоголика» выбрать значение «Запах алкоголя / перегара / сильный запах духов, перебивающий перегар».\n2. В этой же категории выбрать значение «Отечность, нездоровый цвет лица, синяки под глазами».\n\n### Итоговый ожидаемый результат\n\nОба выбранных значения категории «Признаки алкоголика» одновременно отмечены.\n\n### Постусловия\n\n- Не требуются.\n","blocking_reasons":[]}