{"contract_version":1,"status":"draft-ready","draft_markdown":"## TC-ACPD-001\n\n**Название:** Отображение блока «Персональные данные» и полей ФИО\n**Тип:** позитивный\n**Приоритет:** средний\n**package_id:** application-card-client-personal-data-v6\n**Трассировка:** OBL-001; ATOM-001; SRC-001; SRC-001.P01; OBL-002; ATOM-002; SRC-002; SRC-002.P01; OBL-009; ATOM-007; SRC-003; SRC-003.P01; OBL-016; ATOM-012; SRC-004; SRC-004.P01\n\n### Предусловия\n\n1. Открыта новая карточка заявки, созданная действием создания заявки из BSR 38.\n\n### Тестовые данные\n\n- Не требуются.\n\n### Шаги\n\n1. Открыть карточку заявки и перейти к разделу с персональными данными.\n\n### Итоговый ожидаемый результат\n\nВ карточке заявки отображается блок `Персональные данные` с полями `Фамилия`, `Имя` и `Отчество`.\n\n### Постусловия\n\n- Не требуются.\n\n## TC-ACPD-002\n\n**Название:** Редактирование полей ФИО валидными значениями\n**Тип:** позитивный\n**Приоритет:** средний\n**package_id:** application-card-client-personal-data-v6\n**Трассировка:** OBL-004; ATOM-004; SRC-002; SRC-002.P03; OBL-011; ATOM-009; SRC-003; SRC-003.P03; OBL-018; ATOM-014; SRC-004; SRC-004.P03\n\n### Предусловия\n\n1. Открыта новая карточка заявки, созданная действием создания заявки из BSR 38.\n\n### Тестовые данные\n\n- `Фамилия`: `Иванов`.\n- `Имя`: `Иван`.\n- `Отчество`: `Иванович`.\n\n### Шаги\n\n1. Ввести указанные валидные значения в поля `Фамилия`, `Имя` и `Отчество`.\n\n### Итоговый ожидаемый результат\n\nКаждое из полей `Фамилия`, `Имя` и `Отчество` доступно для редактирования и принимает введённое значение.\n\n### Постусловия\n\n- Не требуются.\n\n## TC-ACPD-003\n\n**Название:** Ввод текстового значения с дефисом в поле «Фамилия»\n**Тип:** негативный\n**Приоритет:** средний\n**package_id:** application-card-client-personal-data-v6\n**Трассировка:** OBL-005; ATOM-005; SRC-002; SRC-002.P04\n**Coverage gap:** GAP-001\n**Статус oracle:** ui-calibration-required\n**Статус тест-кейса:** candidate-ui-calibration\n\n### Предусловия\n\n1. Открыта новая карточка заявки, созданная действием создания заявки из BSR 38.\n\n### Тестовые данные\n\n- `Фамилия`: `Иванов-Петров`.\n\n### Шаги\n\n1. Ввести `Иванов-Петров` в поле `Фамилия`.\n\n### Итоговый ожидаемый результат\n\nПоле `Фамилия` принимает значение `Иванов-Петров`, состоящее из текстовых символов и символа `-`.\n\n### Постусловия\n\n- Не требуются.\n\n## TC-ACPD-004\n\n**Название:** Отображение подсказки при вводе фамилии\n**Тип:** негативный\n**Приоритет:** средний\n**package_id:** application-card-client-personal-data-v6\n**Трассировка:** OBL-008; ATOM-006; SRC-002; SRC-002.P05\n**Coverage gap:** GAP-003\n**Статус oracle:** ui-calibration-required\n**Статус тест-кейса:** candidate-ui-calibration\n\n### Предусловия\n\n1. Открыта новая карточка заявки, созданная действием создания заявки из BSR 38.\n2. Интеграция DaData доступна.\n\n### Тестовые данные\n\n- Префикс фамилии: `Иван`.\n\n### Шаги\n\n1. Начать ввод `Иван` в поле `Фамилия`.\n\n### Итоговый ожидаемый результат\n\nДля поля `Фамилия` доступна подсказка, которую пользователь может выбрать.\n\n### Постусловия\n\n- Не требуются.\n\n## TC-ACPD-005\n\n**Название:** Ввод текстового значения с дефисом в поле «Имя»\n**Тип:** негативный\n**Приоритет:** средний\n**package_id:** application-card-client-personal-data-v6\n**Трассировка:** OBL-012; ATOM-010; SRC-003; SRC-003.P04\n**Coverage gap:** GAP-001\n**Статус oracle:** ui-calibration-required\n**Статус тест-кейса:** candidate-ui-calibration\n\n### Предусловия\n\n1. Открыта новая карточка заявки, созданная действием создания заявки из BSR 38.\n\n### Тестовые данные\n\n- `Имя`: `Анна-Мария`.\n\n### Шаги\n\n1. Ввести `Анна-Мария` в поле `Имя`.\n\n### Итоговый ожидаемый результат\n\nПоле `Имя` принимает значение `Анна-Мария`, состоящее из текстовых символов и символа `-`.\n\n### Постусловия\n\n- Не требуются.\n\n## TC-ACPD-006\n\n**Название:** Отображение подсказки при вводе имени\n**Тип:** негативный\n**Приоритет:** средний\n**package_id:** application-card-client-personal-data-v6\n**Трассировка:** OBL-015; ATOM-011; SRC-003; SRC-003.P05\n**Coverage gap:** GAP-003\n**Статус oracle:** ui-calibration-required\n**Статус тест-кейса:** candidate-ui-calibration\n\n### Предусловия\n\n1. Открыта новая карточка заявки, созданная действием создания заявки из BSR 38.\n2. Интеграция DaData доступна.\n\n### Тестовые данные\n\n- Префикс имени: `Анна`.\n\n### Шаги\n\n1. Начать ввод `Анна` в поле `Имя`.\n\n### Итоговый ожидаемый результат\n\nДля поля `Имя` доступна подсказка, которую пользователь может выбрать.\n\n### Постусловия\n\n- Не требуются.\n\n## TC-ACPD-007\n\n**Название:** Ввод текстового значения с дефисом в поле «Отчество»\n**Тип:** негативный\n**Приоритет:** средний\n**package_id:** application-card-client-personal-data-v6\n**Трассировка:** OBL-019; ATOM-015; SRC-004; SRC-004.P04\n**Coverage gap:** GAP-001\n**Статус oracle:** ui-calibration-required\n**Статус тест-кейса:** candidate-ui-calibration\n\n### Предусловия\n\n1. Открыта новая карточка заявки, созданная действием создания заявки из BSR 38.\n\n### Тестовые данные\n\n- `Отчество`: `Иванович-Петрович`.\n\n### Шаги\n\n1. Ввести `Иванович-Петрович` в поле `Отчество`.\n\n### Итоговый ожидаемый результат\n\nПоле `Отчество` принимает значение `Иванович-Петрович`, состоящее из текстовых символов и символа `-`.\n\n### Постусловия\n\n- Не требуются.\n\n## TC-ACPD-008\n\n**Название:** Отображение подсказки при вводе отчества\n**Тип:** негативный\n**Приоритет:** средний\n**package_id:** application-card-client-personal-data-v6\n**Трассировка:** OBL-022; ATOM-016; SRC-004; SRC-004.P05\n**Coverage gap:** GAP-003\n**Статус oracle:** ui-calibration-required\n**Статус тест-кейса:** candidate-ui-calibration\n\n### Предусловия\n\n1. Открыта новая карточка заявки, созданная действием создания заявки из BSR 38.\n2. Интеграция DaData доступна.\n\n### Тестовые данные\n\n- Префикс отчества: `Иванович`.\n\n### Шаги\n\n1. Начать ввод `Иванович` в поле `Отчество`.\n\n### Итоговый ожидаемый результат\n\nДля поля `Отчество` доступна подсказка, которую пользователь может выбрать.\n\n### Постусловия\n\n- Не требуются.\n\n## TC-ACPD-009\n\n**Название:** Недоступность ручного редактирования поля «ID клиента»\n**Тип:** позитивный\n**Приоритет:** средний\n**package_id:** application-card-client-personal-data-v6\n**Трассировка:** OBL-023; ATOM-017; SRC-005; SRC-005.P01\n\n### Предусловия\n\n1. Открыта новая карточка заявки, созданная действием создания заявки из BSR 38.\n\n### Тестовые данные\n\n- Не требуются.\n\n### Шаги\n\n1. Найти поле `ID клиента` в карточке заявки и попытаться изменить его значение вручную.\n\n### Итоговый ожидаемый результат\n\nПоле `ID клиента` отображается в карточке заявки и недоступно для ручного редактирования.\n\n### Постусловия\n\n- Не требуются.\n\n## TC-ACPD-010\n\n**Название:** Заполнение поля «ID клиента» после сохранения заявки\n**Тип:** негативный\n**Приоритет:** средний\n**package_id:** application-card-client-personal-data-v6\n**Трассировка:** OBL-024; ATOM-018; SRC-005; SRC-005.P02\n**Coverage gap:** GAP-003\n**Статус oracle:** ui-calibration-required\n**Статус тест-кейса:** candidate-ui-calibration\n\n### Предусловия\n\n1. Открыта новая карточка заявки по `FIX-ACPD-PORTABLE-SAVE-001`.\n2. В поле `ID клиента` отображается пустое значение.\n\n### Тестовые данные\n\n- `Фамилия`: `Иванов`.\n- `Имя`: `Иван`.\n- `Пол`: `Мужчина`.\n- `Дата рождения`: дата, соответствующая относительному значению `D-30y`.\n- `Клиент менял ФИО`: `Нет`.\n\n### Шаги\n\n1. Сохранить заявку и после успешного сохранения записать видимое значение поля `ID клиента`.\n\n### Итоговый ожидаемый результат\n\nПосле успешного сохранения заявки видимое значение `ID клиента` изменяется с пустого на непустое.\n\n### Постусловия\n\n- Не требуются.\n\n## TC-ACPD-011\n\n**Название:** Перечень активных значений и выбор в поле «Пол»\n**Тип:** негативный\n**Приоритет:** средний\n**package_id:** application-card-client-personal-data-v6\n**Трассировка:** OBL-025; ATOM-019; SRC-006; SRC-006.P01; DICT-001\n**Coverage gap:** GAP-002\n**Статус oracle:** ui-calibration-required\n**Статус тест-кейса:** candidate-ui-calibration\n\n### Предусловия\n\n1. Открыта новая карточка заявки, созданная действием создания заявки из BSR 38.\n\n### Тестовые данные\n\n- Активные значения справочника `Пол клиента`: `Мужчина`, `Женщина`.\n\n### Шаги\n\n1. Открыть элемент выбора поля `Пол`.\n\n### Итоговый ожидаемый результат\n\nПоле `Пол` отображается и доступно для выбора; элемент выбора содержит полный активный перечень значений: `Мужчина`, `Женщина`.\n\n### Постусловия\n\n- Не требуются.\n\n## TC-ACPD-012\n\n**Название:** Обновление поля «Пол» после выбора подсказки ФИО\n**Тип:** негативный\n**Приоритет:** средний\n**package_id:** application-card-client-personal-data-v6\n**Трассировка:** OBL-027; ATOM-020; SRC-006; SRC-006.P02\n**Coverage gap:** GAP-003\n**Статус oracle:** ui-calibration-required\n**Статус тест-кейса:** candidate-ui-calibration\n\n### Предусловия\n\n1. Открыта новая карточка заявки, созданная действием создания заявки из BSR 38.\n2. Интеграция DaData доступна.\n\n### Тестовые данные\n\n- `FIX-ACPD-RUNTIME-DADATA-001`: префикс `Иван`; фактически возвращённая подсказка с доступными составными частями ФИО и известным непустым полом.\n\n### Шаги\n\n1. Записать исходное видимое значение поля `Пол`.\n2. Ввести `Иван` в поле ФИО, выбрать фактически возвращённую подсказку с известным полом и записать итоговое видимое значение поля `Пол`.\n\n### Итоговый ожидаемый результат\n\nПосле выбора подсказки видимое значение поля `Пол` совпадает со значением пола выбранной подсказки; исходное и итоговое значения зафиксированы.\n\n### Постусловия\n\n- Не требуются.","blocking_reasons":[]}