{"contract_version":1,"status":"draft-ready","draft_markdown":"# Тест-кейсы\n\n## TC-VACS-001\n\n**Название:** Начальное значение поля «Визуальная информация» — «Нет»\n**Тип:** позитивный\n**Приоритет:** средний\n**package_id:** visual-assessment-conditional-v2\n**Трассировка:** OBL-COND-001; ATOM-COND-001; SRC-002.P02; BSR 312\n\n### Предусловия\n\n1. Открыт блок формы, содержащий поле «Визуальная информация», до взаимодействия с этим полем.\n\n### Тестовые данные\n\n- Значение по умолчанию: «Нет».\n\n### Шаги\n\n1. Просмотреть значение поля «Визуальная информация» при первом открытии блока.\n\n### Итоговый ожидаемый результат\n\nПоле «Визуальная информация» отображает значение «Нет».\n\n### Постусловия\n\n- Не применимо.\n\n## TC-VACS-002\n\n**Название:** Отображение списка параметров при выборе «Да»\n**Тип:** позитивный\n**Приоритет:** средний\n**package_id:** visual-assessment-conditional-v2\n**Трассировка:** OBL-COND-002; ATOM-COND-002; SRC-003.P01; BSR 314\n\n### Предусловия\n\n1. Открыт блок формы, содержащий поле «Визуальная информация».\n\n### Тестовые данные\n\n- Значение поля «Визуальная информация»: «Да».\n\n### Шаги\n\n1. Выбрать в поле «Визуальная информация» значение «Да».\n\n### Итоговый ожидаемый результат\n\nСписок «Параметры визуальной оценки» отображается.\n\n### Постусловия\n\n- Не применимо.\n\n## TC-VACS-003\n\n**Название:** Скрытие списка параметров при выборе «Нет»\n**Тип:** позитивный\n**Приоритет:** средний\n**package_id:** visual-assessment-conditional-v2\n**Трассировка:** OBL-COND-003; ATOM-COND-003; SRC-003.P02; BSR 314\n\n### Предусловия\n\n1. Открыт блок формы, содержащий поле «Визуальная информация».\n\n### Тестовые данные\n\n- Значение поля «Визуальная информация»: «Нет».\n\n### Шаги\n\n1. Выбрать в поле «Визуальная информация» значение «Нет».\n\n### Итоговый ожидаемый результат\n\nСписок «Параметры визуальной оценки» отсутствует на форме.\n\n### Постусловия\n\n- Не применимо.\n\n## TC-VACS-004\n\n**Название:** Отображение комментария при выборе «Другое» в категории «Признаки алкоголика»\n**Тип:** позитивный\n**Приоритет:** средний\n**package_id:** visual-assessment-conditional-v2\n**Трассировка:** OBL-COND-004; ATOM-COND-004; SRC-003.P06; SRC-009; BSR 317; DICT-101\n\n### Предусловия\n\n1. Открыт блок формы, содержащий поле «Визуальная информация».\n2. В поле «Визуальная информация» выбрано значение «Да».\n3. Отображается список «Параметры визуальной оценки» с категорией «Признаки алкоголика».\n\n### Тестовые данные\n\n- Категория: «Признаки алкоголика».\n- Значение: «Другое (комментарий обязателен)».\n\n### Шаги\n\n1. Выбрать значение «Другое (комментарий обязателен)» в категории «Признаки алкоголика».\n\n### Итоговый ожидаемый результат\n\nДля выбранного значения отображается связанное текстовое поле комментария.\n\n### Постусловия\n\n- Не применимо.\n\n## TC-VACS-005\n\n**Название:** Одновременный выбор двух обычных значений в категории «Признаки алкоголика»\n**Тип:** позитивный\n**Приоритет:** средний\n**package_id:** visual-assessment-conditional-v2\n**Трассировка:** OBL-COND-005; ATOM-COND-005; SRC-002.P04; SRC-003.P08; SRC-005; SRC-006; BSR 313; BSR 315; DICT-101\n\n### Предусловия\n\n1. Открыт блок формы, содержащий поле «Визуальная информация».\n2. В поле «Визуальная информация» выбрано значение «Да».\n3. Отображается список «Параметры визуальной оценки» с категорией «Признаки алкоголика».\n\n### Тестовые данные\n\n- Первое значение: «Запах алкоголя / перегара / сильный запах духов, перебивающий перегар».\n- Второе значение: «Отечность, нездоровый цвет лица, синяки под глазами».\n\n### Шаги\n\n1. Выбрать в категории «Признаки алкоголика» значение «Запах алкоголя / перегара / сильный запах духов, перебивающий перегар».\n2. Выбрать в той же категории значение «Отечность, нездоровый цвет лица, синяки под глазами».\n\n### Итоговый ожидаемый результат\n\nОба выбранных значения одновременно отмечены.\n\n### Постусловия\n\n- Не применимо.\n","blocking_reasons":[]}