{"contract_version":1,"status":"draft-ready","draft_markdown":"# Тест-кейсы\n\n## TC-VAMB-001\n\n**Название:** Отображение поля «Визуальная информация» при открытии блока визуальной оценки\n**Тип:** позитивный\n**Приоритет:** средний\n**package_id:** visual-assessment-medium-scope-benchmark-v5\n**Трассировка:** OBL-001; ATOM-001; SRC-002.P01; BSR 311; SRC-001; SRC-002\n\n### Предусловия\n\n1. Доступна анкета клиента с блоком визуальной оценки.\n\n### Тестовые данные\n\n- Не требуются.\n\n### Шаги\n\n1. Открыть блок визуальной оценки в анкете клиента.\n\n### Итоговый ожидаемый результат\n\nПоле `Визуальная информация` отображается.\n\n### Постусловия\n\n- Не требуются.\n\n## TC-VAMB-002\n\n**Название:** Значение «Нет» по умолчанию в поле «Визуальная информация»\n**Тип:** позитивный\n**Приоритет:** средний\n**package_id:** visual-assessment-medium-scope-benchmark-v5\n**Трассировка:** OBL-002; ATOM-002; SRC-002.P02; BSR 312; SRC-002\n\n### Предусловия\n\n1. Доступна анкета клиента с блоком визуальной оценки до изменения поля `Визуальная информация`.\n\n### Тестовые данные\n\n- Не требуются.\n\n### Шаги\n\n1. Открыть блок визуальной оценки.\n\n### Итоговый ожидаемый результат\n\nВ поле `Визуальная информация` выбрано значение `Нет`.\n\n### Постусловия\n\n- Не требуются.\n\n## TC-VAMB-003\n\n**Название:** Отображение списка параметров после выбора «Да»\n**Тип:** позитивный\n**Приоритет:** средний\n**package_id:** visual-assessment-medium-scope-benchmark-v5\n**Трассировка:** OBL-003; ATOM-003; SRC-002.P03; BSR 313; SRC-002; BSR 314; OBL-004; ATOM-004; SRC-003.P01; SRC-003\n\n### Предусловия\n\n1. Доступна анкета клиента с блоком визуальной оценки.\n\n### Тестовые данные\n\n- Значение поля `Визуальная информация`: `Да`.\n\n### Шаги\n\n1. В поле `Визуальная информация` выбрать значение `Да`.\n\n### Итоговый ожидаемый результат\n\nОтображается список `Параметры визуальной оценки`.\n\n### Постусловия\n\n- Не требуются.\n\n## TC-VAMB-004\n\n**Название:** Скрытие списка параметров при значении «Нет»\n**Тип:** позитивный\n**Приоритет:** средний\n**package_id:** visual-assessment-medium-scope-benchmark-v5\n**Трассировка:** OBL-005; ATOM-005; SRC-003.P02; BSR 314; SRC-003\n\n### Предусловия\n\n1. Доступна анкета клиента с блоком визуальной оценки.\n\n### Тестовые данные\n\n- Значение поля `Визуальная информация`: `Нет`.\n\n### Шаги\n\n1. В поле `Визуальная информация` выбрать значение `Нет`.\n\n### Итоговый ожидаемый результат\n\nСписок `Параметры визуальной оценки` не отображается.\n\n### Постусловия\n\n- Не требуются.\n\n## TC-VAMB-005\n\n**Название:** Полный состав групп и значений списка параметров визуальной оценки\n**Тип:** позитивный\n**Приоритет:** средний\n**package_id:** visual-assessment-medium-scope-benchmark-v5\n**Трассировка:** OBL-006; ATOM-006; SRC-003.P03; BSR 315; SRC-003-SRC-052; DICT-001\n\n### Предусловия\n\n1. Доступна анкета клиента с блоком визуальной оценки.\n\n### Тестовые данные\n\n- Справочник `DICT-001` в режиме покрытия `full-hierarchy`.\n- Значение поля `Визуальная информация`: `Да`.\n\n### Шаги\n\n1. Выбрать значение `Да` в поле `Визуальная информация` и сверить отображаемый список со справочником `DICT-001` в режиме `full-hierarchy`.\n\n### Итоговый ожидаемый результат\n\nСписок `Параметры визуальной оценки` содержит все восемь групп и полный состав активных значений `DICT-001`, без пропусков и добавлений.\n\n### Постусловия\n\n- Не требуются.\n\n## TC-VAMB-006\n\n**Название:** Отображение обычных значений параметров визуальной оценки как checkbox\n**Тип:** позитивный\n**Приоритет:** средний\n**package_id:** visual-assessment-medium-scope-benchmark-v5\n**Трассировка:** OBL-007; ATOM-007; SRC-003.P04; BSR 315; SRC-005-SRC-050; DICT-001\n\n### Предусловия\n\n1. Доступна анкета клиента с открытым списком `Параметры визуальной оценки`.\n\n### Тестовые данные\n\n- Справочник `DICT-001` в режиме покрытия `all-leaf-values`.\n\n### Шаги\n\n1. Проверить тип элемента управления для каждого обычного значения справочника `DICT-001` в режиме `all-leaf-values`.\n\n### Итоговый ожидаемый результат\n\nКаждое обычное значение `DICT-001` доступно как checkbox.\n\n### Постусловия\n\n- Не требуются.\n\n## TC-VAMB-007\n\n**Название:** Фиксация поведения при пустом выборе параметров визуальной оценки\n**Тип:** негативный\n**Приоритет:** средний\n**package_id:** visual-assessment-medium-scope-benchmark-v5\n**Трассировка:** OBL-008; ATOM-008; SRC-003.P05; BSR 316; SRC-003\n**Статус oracle:** ui-calibration-required\n**Статус тест-кейса:** candidate-ui-calibration\n\n### Предусловия\n\n1. Доступна анкета клиента с блоком визуальной оценки.\n\n### Тестовые данные\n\n- `Визуальная информация`: `Да`.\n- Значения списка `Параметры визуальной оценки`: не выбраны.\n\n### Шаги\n\n1. Выбрать `Да` в поле `Визуальная информация`, оставить все параметры невыбранными и выполнить следующее доступное действие формы.\n\n### Итоговый ожидаемый результат\n\n`ui-calibration-required`; `candidate-ui-calibration`: зафиксировать точный ввод и действие, фактическое видимое состояние блока `Параметры визуальной оценки` и результат выполненного действия, не утверждая текст сообщения, подсветку или blocked transition.\n\n### Постусловия\n\n- Не требуются.\n\n## TC-VAMB-008\n\n**Название:** Отображение комментария после выбора «Другое»\n**Тип:** позитивный\n**Приоритет:** средний\n**package_id:** visual-assessment-medium-scope-benchmark-v5\n**Трассировка:** OBL-009; ATOM-009; SRC-003.P06; BSR 317; SRC-009; SRC-019; SRC-024; SRC-030; SRC-036; SRC-043; SRC-050; DICT-001; DICT-108\n\n### Предусловия\n\n1. Доступна анкета клиента с открытым списком `Параметры визуальной оценки`.\n\n### Тестовые данные\n\n- Checkbox `Другое` в группе, где он предусмотрен.\n\n### Шаги\n\n1. Выбрать checkbox `Другое`.\n\n### Итоговый ожидаемый результат\n\nВ той же группе отображается текстовое поле комментария.\n\n### Постусловия\n\n- Не требуются.\n\n## TC-VAMB-009\n\n**Название:** Фиксация поведения при пустом комментарии для «Другое»\n**Тип:** негативный\n**Приоритет:** средний\n**package_id:** visual-assessment-medium-scope-benchmark-v5\n**Трассировка:** OBL-010; ATOM-010; SRC-003.P07; BSR 317; SRC-009; SRC-019; SRC-024; SRC-030; SRC-036; SRC-043; SRC-050; DICT-001\n**Статус oracle:** ui-calibration-required\n**Статус тест-кейса:** candidate-ui-calibration\n\n### Предусловия\n\n1. Доступна анкета клиента с открытым списком `Параметры визуальной оценки`.\n\n### Тестовые данные\n\n- Checkbox `Другое` в группе, где он предусмотрен.\n- Комментарий: пустое значение.\n\n### Шаги\n\n1. Выбрать `Другое`, оставить открывшееся текстовое поле комментария пустым и выполнить следующее доступное действие формы.\n\n### Итоговый ожидаемый результат\n\n`ui-calibration-required`; `candidate-ui-calibration`: зафиксировать точный ввод и действие, фактическое видимое состояние поля комментария и результат выполненного действия, не утверждая текст сообщения, подсветку или blocked transition.\n\n### Постусловия\n\n- Не требуются.\n\n## TC-VAMB-010\n\n**Название:** Отображение standalone-полей «Комментарий» отдельно от «Другое»\n**Тип:** позитивный\n**Приоритет:** средний\n**package_id:** visual-assessment-medium-scope-benchmark-v5\n**Трассировка:** OBL-011; ATOM-011; SRC-010.P01; SRC-010; SRC-020; SRC-051; SRC-052\n\n### Предусловия\n\n1. Доступна анкета клиента с блоком визуальной оценки.\n\n### Тестовые данные\n\n- Значение поля `Визуальная информация`: `Да`.\n\n### Шаги\n\n1. Выбрать `Да` в поле `Визуальная информация` и осмотреть standalone-строки `Комментарий`.\n\n### Итоговый ожидаемый результат\n\nStandalone-строки `Комментарий` отображаются как отдельные поля ввода и не являются checkbox `Другое`.\n\n### Постусловия\n\n- Не требуются.\n\n## TC-VAMB-011\n\n**Название:** Отображение введённого текста в standalone-поле «Комментарий»\n**Тип:** позитивный\n**Приоритет:** средний\n**package_id:** visual-assessment-medium-scope-benchmark-v5\n**Трассировка:** OBL-012; ATOM-012; SRC-010.P02; SRC-010; SRC-020; SRC-051; SRC-052\n\n### Предусловия\n\n1. Доступна анкета клиента с открытым standalone-полем `Комментарий`.\n\n### Тестовые данные\n\n- Текст комментария: `Наблюдение теста`.\n\n### Шаги\n\n1. Ввести `Наблюдение теста` в standalone-поле `Комментарий`.\n\n### Итоговый ожидаемый результат\n\nStandalone-поле `Комментарий` отображает значение `Наблюдение теста`.\n\n### Постусловия\n\n- Не требуются.\n\n## TC-VAMB-012\n\n**Название:** Одновременный выбор двух обычных значений критерия\n**Тип:** позитивный\n**Приоритет:** средний\n**package_id:** visual-assessment-medium-scope-benchmark-v5\n**Трассировка:** OBL-013; ATOM-013; SRC-003.P08; BSR 313; BSR 315; SRC-002; SRC-003; SRC-005-SRC-050; DICT-001\n\n### Предусловия\n\n1. Доступна анкета клиента с открытым списком `Параметры визуальной оценки`.\n\n### Тестовые данные\n\n<!-- runner-reference-fixture:start OBL-013 -->\n- Использовать точные reference-only fixture values в указанном порядке:\n- Группа fixture `DICT-001 > DICT-101`: `Признаки алкоголика`\n- Значение fixture `DICT-001 > DICT-101`: `Запах алкоголя / перегара / сильный запах духов, перебивающий перегар`\n- Значение fixture `DICT-001 > DICT-101`: `Отечность, нездоровый цвет лица, синяки под глазами`\n<!-- runner-reference-fixture:end OBL-013 -->\n\n### Шаги\n\n1. В группе `Признаки алкоголика` последовательно выбрать `Запах алкоголя / перегара / сильный запах духов, перебивающий перегар` и `Отечность, нездоровый цвет лица, синяки под глазами`.\n\n### Итоговый ожидаемый результат\n\nОба выбранных checkbox остаются выбранными одновременно.\n\n### Постусловия\n\n- Не требуются.\n","blocking_reasons":[]}